{"conflicts":[],"createdAt":"2026-09-16T12:37:00Z","operations":[{"afterSha256":"657b6ac2ad8e528ebed4b7ec1137fe7454ce0702b9d35a08dc331691f7b282bf","artifactClass":"dioxus-authored","artifactPath":"skills/dioxus-core/SKILL.md","beforeSha256":"657b6ac2ad8e528ebed4b7ec1137fe7454ce0702b9d35a08dc331691f7b282bf","blockers":[{"code":"ambiguous-mapping","detail":"artifact has no provenance mapping"}],"operation":"noop","provenanceRevisionId":"unmapped","verdict":"blocked"},{"afterSha256":"95eae981302a101a402a8009aa05e7ac5fdf12a13cf36cc44b2010daeae6733f","artifactClass":"dioxus-authored","artifactPath":"skills/dioxus-core/references/concepts.md","beforeSha256":"95eae981302a101a402a8009aa05e7ac5fdf12a13cf36cc44b2010daeae6733f","blockers":[{"code":"ambiguous-mapping","detail":"artifact has no provenance mapping"}],"operation":"noop","provenanceRevisionId":"unmapped","verdict":"blocked"},{"afterSha256":"44cb3fb864254dae948e884c67c3f720c9f7ed4984d76bb0a6ea86c43bf3df0a","artifactClass":"dioxus-authored","artifactPath":"templates/model-invoked-SKILL.md","beforeSha256":"44cb3fb864254dae948e884c67c3f720c9f7ed4984d76bb0a6ea86c43bf3df0a","blockers":[{"code":"ambiguous-mapping","detail":"artifact has no provenance mapping"}],"operation":"noop","provenanceRevisionId":"unmapped","verdict":"blocked"},{"afterSha256":"950cbedeafd0ff34e28c1367d1267e2c40655bed8ecaec8acfb221b04af0d22d","artifactClass":"dioxus-authored","artifactPath":"templates/user-invoked-SKILL.md","beforeSha256":"950cbedeafd0ff34e28c1367d1267e2c40655bed8ecaec8acfb221b04af0d22d","blockers":[{"code":"ambiguous-mapping","detail":"artifact has no provenance mapping"}],"operation":"noop","provenanceRevisionId":"unmapped","verdict":"blocked"}],"reportId":"sha256:48f70302de7b5d815b7e928964ad53f8c24a18130feb4be0f399eba1a477354b","schemaVersion":1,"sourcePrecedence":["local-source","local-tests-examples","local-agents","local-architecture","upstream-source","public-docs"],"sourceState":{"dirty":false,"ref":"main","repository":"https://github.com/DioxusLabs/dioxus.git","sha":"fda3dc9c2b10ddf4417edcbb98caa9613ac92d26"},"validation":{"checks":[{"detail":"{\"artifacts\":[{\"artifactPath\":\"skills/dioxus-core/SKILL.md\",\"targetSha256\":\"657b6ac2ad8e528ebed4b7ec1137fe7454ce0702b9d35a08dc331691f7b282bf\"},{\"artifactPath\":\"skills/dioxus-core/references/concepts.md\",\"targetSha256\":\"95eae981302a101a402a8009aa05e7ac5fdf12a13cf36cc44b2010daeae6733f\"},{\"artifactPath\":\"templates/model-invoked-SKILL.md\",\"targetSha256\":\"44cb3fb864254dae948e884c67c3f720c9f7ed4984d76bb0a6ea86c43bf3df0a\"},{\"artifactPath\":\"templates/user-invoked-SKILL.md\",\"targetSha256\":\"950cbedeafd0ff34e28c1367d1267e2c40655bed8ecaec8acfb221b04af0d22d\"}],\"comparison\":{\"repository\":\"https://github.com/DioxusLabs/dioxus.git\",\"sha\":\"fda3dc9c2b10ddf4417edcbb98caa9613ac92d26\"},\"remotes\":\"origin\\thttps://github.com/DioxusLabs/dioxus.git (fetch)\\norigin\\thttps://github.com/DioxusLabs/dioxus.git (push)\",\"sourceSnapshotSha256\":\"4532b03cac4dc6a8381929e1d6c0029d9f5feaf8533426e013bb4bbac12ab022\",\"submodules\":\"\",\"targetManifest\":{\"skills/dioxus-core/SKILL.md\":\"657b6ac2ad8e528ebed4b7ec1137fe7454ce0702b9d35a08dc331691f7b282bf\",\"skills/dioxus-core/references/concepts.md\":\"95eae981302a101a402a8009aa05e7ac5fdf12a13cf36cc44b2010daeae6733f\",\"templates/model-invoked-SKILL.md\":\"44cb3fb864254dae948e884c67c3f720c9f7ed4984d76bb0a6ea86c43bf3df0a\",\"templates/user-invoked-SKILL.md\":\"950cbedeafd0ff34e28c1367d1267e2c40655bed8ecaec8acfb221b04af0d22d\"}}","name":"inspection-v1","verdict":"pass"},{"detail":"source snapshots agree","name":"source-stable","verdict":"pass"}],"verdict":"blocked"}}
