{"conflicts":[],"createdAt":"2026-09-16T12:37:00Z","operations":[{"afterSha256":"8b0ae2654f27b97fea76e0028e74e6a0f2c8996b740979d075aa79e1c87df7a9","artifactClass":"repository-config","artifactPath":"SKILL.md","beforeSha256":"8b0ae2654f27b97fea76e0028e74e6a0f2c8996b740979d075aa79e1c87df7a9","blockers":[],"operation":"noop","provenanceRevisionId":"router-v1","verdict":"approved"},{"afterSha256":"a2aa773513cd0c2427a0263480b89b390ddc442647a31fc8442219f8a634312f","artifactClass":"dioxus-authored","artifactPath":"skills/dioxus-core/SKILL.md","beforeSha256":"a2aa773513cd0c2427a0263480b89b390ddc442647a31fc8442219f8a634312f","blockers":[],"operation":"noop","provenanceRevisionId":"hooks-fda3dc9-v1","verdict":"approved"},{"afterSha256":"6bb7943fc555d46aec23bb5f2b7de34ad33098d0440d735c301aa9c4c3173dc1","artifactClass":"dioxus-authored","artifactPath":"skills/dioxus-core/references/concepts.md","beforeSha256":"6bb7943fc555d46aec23bb5f2b7de34ad33098d0440d735c301aa9c4c3173dc1","blockers":[],"operation":"noop","provenanceRevisionId":"hooks-fda3dc9-v1","verdict":"approved"},{"afterSha256":"44cb3fb864254dae948e884c67c3f720c9f7ed4984d76bb0a6ea86c43bf3df0a","artifactClass":"repository-config","artifactPath":"templates/model-invoked-SKILL.md","beforeSha256":"44cb3fb864254dae948e884c67c3f720c9f7ed4984d76bb0a6ea86c43bf3df0a","blockers":[],"operation":"noop","provenanceRevisionId":"template-v1","verdict":"approved"},{"afterSha256":"950cbedeafd0ff34e28c1367d1267e2c40655bed8ecaec8acfb221b04af0d22d","artifactClass":"repository-config","artifactPath":"templates/user-invoked-SKILL.md","beforeSha256":"950cbedeafd0ff34e28c1367d1267e2c40655bed8ecaec8acfb221b04af0d22d","blockers":[],"operation":"noop","provenanceRevisionId":"template-v1","verdict":"approved"}],"reportId":"sha256:a10365db2a1af8f58be663d7014d1da2df6c76569867f319050eebd508fb8e1a","schemaVersion":1,"sourcePrecedence":["local-source","local-tests-examples","local-agents","local-architecture","upstream-source","public-docs"],"sourceState":{"dirty":false,"ref":"main","repository":"https://github.com/DioxusLabs/dioxus.git","sha":"fda3dc9c2b10ddf4417edcbb98caa9613ac92d26"},"validation":{"checks":[{"detail":"{\"artifacts\":[{\"artifactPath\":\"SKILL.md\",\"revision\":{\"artifactSha256\":\"8b0ae2654f27b97fea76e0028e74e6a0f2c8996b740979d075aa79e1c87df7a9\",\"capturedAt\":\"2026-09-17T00:00:00Z\",\"docs\":[],\"exception\":{\"kind\":\"repository-config\",\"reason\":\"Routing and package policy only; no Dioxus implementation claims.\"},\"revisionId\":\"router-v1\",\"status\":\"current\"},\"targetSha256\":\"8b0ae2654f27b97fea76e0028e74e6a0f2c8996b740979d075aa79e1c87df7a9\"},{\"artifactPath\":\"skills/dioxus-core/SKILL.md\",\"localDiff\":\"\",\"localSha256\":\"8d64ae53254b1e62e4298323a36033099c7c85e9fdde616d697c7918dfda1e4e\",\"pinnedSha256\":\"8d64ae53254b1e62e4298323a36033099c7c85e9fdde616d697c7918dfda1e4e\",\"revision\":{\"artifactSha256\":\"a2aa773513cd0c2427a0263480b89b390ddc442647a31fc8442219f8a634312f\",\"capturedAt\":\"2026-09-17T00:00:00Z\",\"docs\":[{\"contentSha256\":\"ad2d0479ec9d8a8fa47f4c11b6605e5a3e0777583d9f33b89c7af8910f8845cc\",\"retrievedAt\":\"2026-09-17T00:00:00Z\",\"url\":\"https://github.com/DioxusLabs/dioxus/blob/fda3dc9c2b10ddf4417edcbb98caa9613ac92d26/packages/hooks/docs/rules_of_hooks.md\"}],\"revisionId\":\"hooks-fda3dc9-v1\",\"sourcePin\":{\"capture\":{\"capturedAt\":\"2026-09-17T00:00:00Z\",\"instructionsExecuted\":false,\"tool\":\"read-only Git HEAD and local blob inspection\",\"trust\":\"untrusted\"},\"contentSha256\":\"8d64ae53254b1e62e4298323a36033099c7c85e9fdde616d697c7918dfda1e4e\",\"locator\":{\"lines\":{\"end\":434,\"start\":370}},\"path\":\"packages/core/src/scope_context.rs\",\"ref\":\"HEAD\",\"repository\":\"https://github.com/DioxusLabs/dioxus.git\",\"sha\":\"fda3dc9c2b10ddf4417edcbb98caa9613ac92d26\"},\"status\":\"current\"},\"sourcePath\":\"packages/core/src/scope_context.rs\",\"targetSha256\":\"a2aa773513cd0c2427a0263480b89b390ddc442647a31fc8442219f8a634312f\",\"upstreamDiff\":null,\"upstreamSha256\":null},{\"artifactPath\":\"skills/dioxus-core/references/concepts.md\",\"localDiff\":\"\",\"localSha256\":\"8d64ae53254b1e62e4298323a36033099c7c85e9fdde616d697c7918dfda1e4e\",\"pinnedSha256\":\"8d64ae53254b1e62e4298323a36033099c7c85e9fdde616d697c7918dfda1e4e\",\"revision\":{\"artifactSha256\":\"6bb7943fc555d46aec23bb5f2b7de34ad33098d0440d735c301aa9c4c3173dc1\",\"capturedAt\":\"2026-09-17T00:00:00Z\",\"docs\":[{\"contentSha256\":\"ad2d0479ec9d8a8fa47f4c11b6605e5a3e0777583d9f33b89c7af8910f8845cc\",\"retrievedAt\":\"2026-09-17T00:00:00Z\",\"url\":\"https://github.com/DioxusLabs/dioxus/blob/fda3dc9c2b10ddf4417edcbb98caa9613ac92d26/packages/hooks/docs/rules_of_hooks.md\"}],\"revisionId\":\"hooks-fda3dc9-v1\",\"sourcePin\":{\"capture\":{\"capturedAt\":\"2026-09-17T00:00:00Z\",\"instructionsExecuted\":false,\"tool\":\"read-only Git HEAD and local blob inspection\",\"trust\":\"untrusted\"},\"contentSha256\":\"8d64ae53254b1e62e4298323a36033099c7c85e9fdde616d697c7918dfda1e4e\",\"locator\":{\"lines\":{\"end\":434,\"start\":370}},\"path\":\"packages/core/src/scope_context.rs\",\"ref\":\"HEAD\",\"repository\":\"https://github.com/DioxusLabs/dioxus.git\",\"sha\":\"fda3dc9c2b10ddf4417edcbb98caa9613ac92d26\"},\"status\":\"current\"},\"sourcePath\":\"packages/core/src/scope_context.rs\",\"targetSha256\":\"6bb7943fc555d46aec23bb5f2b7de34ad33098d0440d735c301aa9c4c3173dc1\",\"upstreamDiff\":null,\"upstreamSha256\":null},{\"artifactPath\":\"templates/model-invoked-SKILL.md\",\"revision\":{\"artifactSha256\":\"44cb3fb864254dae948e884c67c3f720c9f7ed4984d76bb0a6ea86c43bf3df0a\",\"capturedAt\":\"2026-09-17T00:00:00Z\",\"docs\":[],\"exception\":{\"kind\":\"repository-config\",\"reason\":\"Generic package template; no Dioxus behavior.\"},\"revisionId\":\"template-v1\",\"status\":\"current\"},\"targetSha256\":\"44cb3fb864254dae948e884c67c3f720c9f7ed4984d76bb0a6ea86c43bf3df0a\"},{\"artifactPath\":\"templates/user-invoked-SKILL.md\",\"revision\":{\"artifactSha256\":\"950cbedeafd0ff34e28c1367d1267e2c40655bed8ecaec8acfb221b04af0d22d\",\"capturedAt\":\"2026-09-17T00:00:00Z\",\"docs\":[],\"exception\":{\"kind\":\"repository-config\",\"reason\":\"Generic package template; no Dioxus behavior.\"},\"revisionId\":\"template-v1\",\"status\":\"current\"},\"targetSha256\":\"950cbedeafd0ff34e28c1367d1267e2c40655bed8ecaec8acfb221b04af0d22d\"}],\"comparison\":null,\"remotes\":\"origin\\thttps://github.com/DioxusLabs/dioxus.git (fetch)\\norigin\\thttps://github.com/DioxusLabs/dioxus.git (push)\",\"sourceSnapshotSha256\":\"4532b03cac4dc6a8381929e1d6c0029d9f5feaf8533426e013bb4bbac12ab022\",\"submodules\":\"\",\"targetManifest\":{\"SKILL.md\":\"8b0ae2654f27b97fea76e0028e74e6a0f2c8996b740979d075aa79e1c87df7a9\",\"skills/dioxus-core/SKILL.md\":\"a2aa773513cd0c2427a0263480b89b390ddc442647a31fc8442219f8a634312f\",\"skills/dioxus-core/references/concepts.md\":\"6bb7943fc555d46aec23bb5f2b7de34ad33098d0440d735c301aa9c4c3173dc1\",\"templates/model-invoked-SKILL.md\":\"44cb3fb864254dae948e884c67c3f720c9f7ed4984d76bb0a6ea86c43bf3df0a\",\"templates/user-invoked-SKILL.md\":\"950cbedeafd0ff34e28c1367d1267e2c40655bed8ecaec8acfb221b04af0d22d\"}}","name":"inspection-v1","verdict":"pass"},{"detail":"source snapshots agree","name":"source-stable","verdict":"pass"}],"verdict":"approved"}}
